{
  "schema_version": "structure-factory-binder-capability-ledger-v1",
  "evidence_scope": "public_repository_only",
  "state_definitions": {
    "listed": "Named in the public software registry.",
    "documented": "Listed and described in a public tool card or workflow document.",
    "contract_checked": "A public local contract or toolcheck module is present. This is not evidence that a provider served a request."
  },
  "tools": [
    {
      "id": "genie3",
      "kind": "software",
      "registry_id": "genie3",
      "roles": ["generator"],
      "evidence_level": "contract_checked",
      "license_gate": "dependency_and_weight_terms_review",
      "provider_bound": false,
      "execution_available": false,
      "public_evidence": ["references/software-registry.yaml", "modules/lane-modules/genie3.toolcheck.v1.json"]
    },
    {
      "id": "rfdiffusion",
      "kind": "software",
      "registry_id": "rfdiffusion",
      "roles": ["generator"],
      "evidence_level": "documented",
      "license_gate": "terms_review",
      "provider_bound": false,
      "execution_available": false,
      "public_evidence": ["references/software-registry.yaml", "references/published-binder-comparison-workflow.json"]
    },
    {
      "id": "rfdiffusion3",
      "kind": "software",
      "registry_id": "rfdiffusion3",
      "roles": ["generator"],
      "evidence_level": "documented",
      "license_gate": "weight_terms_review",
      "provider_bound": false,
      "execution_available": false,
      "public_evidence": ["references/software-registry.yaml", "tools/rfdiffusion3.md", "references/published-binder-comparison-workflow.json"]
    },
    {
      "id": "proteinmpnn",
      "kind": "software",
      "registry_id": "proteinmpnn",
      "roles": ["sequence_designer"],
      "evidence_level": "contract_checked",
      "license_gate": "none",
      "provider_bound": false,
      "execution_available": false,
      "public_evidence": ["references/software-registry.yaml", "modules/lane-modules/proteinmpnn.toolcheck.v1.json"]
    },
    {
      "id": "solublempnn",
      "kind": "software",
      "registry_id": "solublempnn",
      "roles": ["sequence_designer"],
      "evidence_level": "contract_checked",
      "license_gate": "none",
      "provider_bound": false,
      "execution_available": false,
      "public_evidence": ["references/software-registry.yaml", "modules/lane-modules/proteinmpnn.toolcheck.v1.json", "references/published-binder-comparison-workflow.json"]
    },
    {
      "id": "caliby",
      "kind": "software",
      "registry_id": "caliby",
      "roles": ["sequence_designer"],
      "evidence_level": "documented",
      "license_gate": "none",
      "provider_bound": false,
      "execution_available": false,
      "public_evidence": ["references/software-registry.yaml", "references/published-binder-comparison-workflow.json"]
    },
    {
      "id": "solublecaliby",
      "kind": "software",
      "registry_id": "solublecaliby",
      "roles": ["sequence_designer"],
      "evidence_level": "documented",
      "license_gate": "none",
      "provider_bound": false,
      "execution_available": false,
      "public_evidence": ["references/software-registry.yaml", "references/published-binder-comparison-workflow.json"]
    },
    {
      "id": "ligandmpnn",
      "kind": "software",
      "registry_id": "ligandmpnn",
      "roles": ["sequence_designer"],
      "evidence_level": "listed",
      "license_gate": "none",
      "provider_bound": false,
      "execution_available": false,
      "public_evidence": ["references/software-registry.yaml"]
    },
    {
      "id": "bindcraft",
      "kind": "software",
      "registry_id": "bindcraft",
      "roles": ["generator", "sequence_designer"],
      "evidence_level": "documented",
      "license_gate": "pyrosetta_terms_af2_weights_and_dependency_review",
      "provider_bound": false,
      "execution_available": false,
      "public_evidence": ["references/software-registry.yaml", "tools/bindcraft.md"]
    },
    {
      "id": "freebindcraft",
      "kind": "software",
      "registry_id": "freebindcraft",
      "roles": ["generator", "sequence_designer"],
      "evidence_level": "documented",
      "license_gate": "af2_parameter_terms_review",
      "provider_bound": false,
      "execution_available": false,
      "public_evidence": ["references/software-registry.yaml", "references/published-binder-comparison-workflow.json"]
    },
    {
      "id": "foldcraft",
      "kind": "software",
      "registry_id": "foldcraft",
      "roles": ["generator", "sequence_designer"],
      "evidence_level": "documented",
      "license_gate": "af2_parameter_terms_review",
      "provider_bound": false,
      "execution_available": false,
      "public_evidence": ["references/software-registry.yaml", "references/published-binder-comparison-workflow.json"]
    },
    {
      "id": "boltzdesign1",
      "kind": "software",
      "registry_id": "boltzdesign1",
      "roles": ["generator", "sequence_designer"],
      "evidence_level": "documented",
      "license_gate": "none",
      "provider_bound": false,
      "execution_available": false,
      "public_evidence": ["references/software-registry.yaml", "references/published-binder-comparison-workflow.json"]
    },
    {
      "id": "protein-hunter",
      "kind": "software",
      "registry_id": "protein_hunter",
      "roles": ["generator"],
      "evidence_level": "documented",
      "license_gate": "none",
      "provider_bound": false,
      "execution_available": false,
      "public_evidence": ["references/software-registry.yaml", "references/published-binder-comparison-workflow.json"]
    },
    {
      "id": "pxdesign",
      "kind": "software",
      "registry_id": "pxdesign",
      "roles": ["generator"],
      "evidence_level": "documented",
      "license_gate": "weight_terms_review",
      "provider_bound": false,
      "execution_available": false,
      "public_evidence": ["references/software-registry.yaml", "references/published-binder-comparison-workflow.json"]
    },
    {
      "id": "proteina-complexa",
      "kind": "software",
      "registry_id": "proteina-complexa",
      "roles": ["generator", "sequence_designer"],
      "evidence_level": "documented",
      "license_gate": "nvidia_open_model_terms",
      "provider_bound": false,
      "execution_available": false,
      "public_evidence": ["references/software-registry.yaml", "references/published-binder-comparison-workflow.json"]
    },
    {
      "id": "boltzgen",
      "kind": "software",
      "registry_id": "boltzgen",
      "roles": ["generator", "sequence_designer"],
      "evidence_level": "documented",
      "license_gate": "terms_and_weights_review",
      "provider_bound": false,
      "execution_available": false,
      "public_evidence": ["references/software-registry.yaml", "tools/boltzgen.md"]
    },
    {
      "id": "promera",
      "kind": "software",
      "registry_id": "promera",
      "roles": ["generator", "sequence_designer", "predictor"],
      "evidence_level": "documented",
      "license_gate": "repo_weight_msa_and_confidence_output_review",
      "provider_bound": false,
      "execution_available": false,
      "public_evidence": ["references/software-registry.yaml"]
    },
    {
      "id": "switchcraft",
      "kind": "software",
      "registry_id": "switchcraft",
      "roles": ["generator"],
      "evidence_level": "documented",
      "license_gate": "dependency_and_weight_terms_review",
      "provider_bound": false,
      "execution_available": false,
      "public_evidence": ["references/software-registry.yaml", "tools/switchcraft.md"]
    },
    {
      "id": "helixdiff",
      "kind": "software",
      "registry_id": "helixdiff",
      "roles": ["generator"],
      "evidence_level": "documented",
      "license_gate": "current_source_dependency_weight_and_license_review",
      "provider_bound": false,
      "execution_available": false,
      "public_evidence": ["references/software-registry.yaml", "tools/helixdiff.md"]
    },
    {
      "id": "pepglad",
      "kind": "software",
      "registry_id": "pepglad",
      "roles": ["generator", "sequence_designer"],
      "evidence_level": "documented",
      "license_gate": "current_branch_dependency_weight_and_license_review",
      "provider_bound": false,
      "execution_available": false,
      "public_evidence": ["references/software-registry.yaml", "tools/pepglad.md"]
    },
    {
      "id": "evobind",
      "kind": "software",
      "registry_id": "evobind",
      "roles": ["sequence_designer", "scorer"],
      "evidence_level": "documented",
      "license_gate": "current_source_dependency_alphafold_weight_and_license_review",
      "provider_bound": false,
      "execution_available": false,
      "public_evidence": ["references/software-registry.yaml", "tools/evobind.md"]
    },
    {
      "id": "rfpeptides",
      "kind": "software",
      "registry_id": "rfpeptides",
      "roles": ["generator"],
      "evidence_level": "documented",
      "license_gate": "dependency_container_review",
      "provider_bound": false,
      "execution_available": false,
      "public_evidence": ["references/software-registry.yaml", "tools/rfpeptides.md"]
    },
    {
      "id": "cosine",
      "kind": "software",
      "registry_id": "cosine",
      "roles": ["sequence_designer", "scorer"],
      "evidence_level": "documented",
      "license_gate": "none",
      "provider_bound": false,
      "execution_available": false,
      "public_evidence": ["references/software-registry.yaml", "tools/cosine.md"]
    },
    {
      "id": "rfantibody",
      "kind": "software",
      "registry_id": "rfantibody",
      "roles": ["generator", "sequence_designer"],
      "evidence_level": "listed",
      "license_gate": "weight_terms_review",
      "provider_bound": false,
      "execution_available": false,